id,date,time,content,first_name,last_name,status,slug,type
4356,13-12-18,21:29:23,"The British baritone David Wilson-Johnson was born in Northampton, studied Modern Languages at St Catharine's College, Cambridge and singing at the Royal Academy of Music in London, where he won many prizes including the Dove Prize for most distinguished student. In the early days he sang in the choirs of St Margaret's Westminster (Richard Hickox), The London Oratory, (John Hoban) the BBC Singers (John Poole) and the Monteverdi Choir (John Eliot Gardiner.) Since then, over a career already spanning forty years, he has been a guest of the major opera houses and orchestras and festivals worldwide. He has sung under the most distinguished conductors including David Atherton, Pierre Boulez, Frans Br‰Û_ÌÊÌ_åÂ‰öÇggen, Sir Colin and Sir Andrew Davis, Charles Dutoit, Carlo-Maria Giulini, Hartmut Haenchen, Nikolaus Harnoncourt, Oliver Knussen, Reinbert de Leeuw, Gustav Leonhardt, Sir Charles Mackerras, Zubin Mehta, Kenneth Montgomery, Andr‰Û_ÌÊÌ_åÂå© Previn, Sir Simon Rattle, Gennadi Rozhdestvensky and Evgeny Svetlanov.

He made his operatic debut at Covent Garden in Henze's We Come to the River in 1976 and sang regularly there over twenty-one years in a wide range of roles including Billy Budd, Le Rossignol, L'Enfant et les Sortilleges, Boris Godunov, Turandot, Werther, Die Zauberfl‰Û_ÌÊÌ_‰Û_ÌÊÌàte, Arianna, Cos‰Û_ÌÊÌ_‰Û_Ì¢‰ÛÊ fan tutte. He also sang in Peter Grimes (Amsterdam, Brussels, Geneva, Madrid), Billy Budd (ENO, ROH, Opera Bastille), La Damnation de Faust (Turin, Tanglewood), Die Meistersinger von N‰Û_ÌÊÌ_åÂ‰öÇrnberg (Amsterdam, Paris), Die Zauberfl‰Û_ÌÊÌ_‰Û_ÌÊÌàte (Opera Garnier), Tristan und Isolde ( London, Monte Carlo), Ariadne auf Naxos (Paris),Punch and Judy, Die Gluckliche Hand, Von Heute auf Morgen, Les Troyens, Les Indes Galantes (Amsterdam) Rameau's Les Boreades (Salzburg Festival), Eight Songs for a Mad King by Peter Maxwell Davies (Op‰Û_ÌÊÌ_åÂå©ra Comique), The Lighthouse (Edinburgh Festival), Sir Michael Tippett's A Midsummer Marriage (tv film) and the title role in Messiaen's St Fran‰Û_ÌÊÌ_‰ö_Ì_ois d'Assise (London, BBCTV, Lyon, Amsterdam, Brussels, New York and Edinburgh Festival).

His most memorable concerts have been Mahler 8 with the NYO under Rattle, Tippett's King Priam under David Atherton at the BBC Proms, Henze's Elegy for Young Lovers under Knussen at the Concertgebouw Amsterdam, Ravel's L'Heure Espagnole, and Brahms Requiem under Previn in Carnegie Hall, Pittsburgh and Oslo and Haydn's Seasons under Rattle, plus The Creation (educational projects in Amsterdam and Paris) with Br‰Û_ÌÊÌ_åÂ‰öÇggen, Britten's Death in Venice under Montgomery and Enescu's Oedipe at the Holland Festival. He sang Beethoven's Ninth under Leonard Slatkin at the Last Night of the Proms in 2001 after the events of 9/11 to a worldwide audience of 340 million.

Discography: Over 200 CDs including Tubular Bells and Ommadawn (Mike Oldfield), the film Give my regards to Broad Street (The Beatles), and more traditionally works of Bach ( Cantatas with Leonhardt, B minor Mass with Giulini) Beethoven (Fidelio with Mackerras), Stravinsky (Knussen), Schoenberg (Knussen and Robert Craft), Ravel (L'Heure Espagnole, L'Enfant et les Sortilleges with Previn), Frank Martin's Jedermann Monologues (Matthias Bamert). Mahler 8 with Simon Rattle. Since student days he has worked with the pianist David Owen Norris and together they have recorded many recitals including Schubert's Winterreise, songs by Finzi and Quilter and many first performances of works written for them ( Michael Berkeley, Edward Cowie, Trevor Hold, Lutoslawski, Tippett) and Stravinsky and Tschaikowsky.

In 2006 he decided to retire from the operatic stage and his last performances were the title roles in Tippett's King Priam (Nationale Reisopera and BBC Proms), Albeniz's Merlin (Teatro Real Madrid), Shostakovitch's The Nose under Gennadi Rozhdestvensky (Netherlands Opera) and Messiaen's Saint Fran‰Û_ÌÊÌ_‰ö_Ì_ois d'Assise (Edinburgh Festival).

Recent concert projects included a tour with Sir Simon Rattle and the Orchestra of the Age of Enlightenment of Schumann's Paradies und die Peri as well as tours with Frans Bruggen and the Orchestra of the 18th Century singing Die Sch‰Û_ÌÊÌ_‰Û_ÌÊÌàpfung and Beethoven's 9th Symphony. He sang performances of La Damnation de Faust with Charles Dutoit with the Bavarian Radio Symphony Orchestra. the Sydney Symphony, the Chicago Symphony and the Philharmonia, and Romeo et Juliette with the Philadelphia Orchestra. He sang Elias in Strasbourg under David Hill, the title role in Owen Wingrave in Tapiola with Stefan Asbury, Tippett's A Child of our Time with Sir Andrew Davis and the Royal Philharmonic Orchestra and Elgar's Dream of Gerontius under Vladimir Ashkenazy with the Sydney Symphony Orchestra.

David Wilson-Johnson teaches in Amsterdam and London and is a Fellow of the Royal Academy of Music.

He lives between houses in London, Amsterdam and South-West France.",David,Wilson-Johnson,publish,david-wilson-johnson,page
4358,13-12-18,21:38:54,"Sarah Walker is an artist of international standing both on the opera stage and on the concert platform world-wide. Having initially studied violin at the Royal College of Music, London, she subsequently began taking vocal lessons with the celebrated Hungarian teacher, Madame Vera Rozsa, with whom she built an extraordinarily wide repertoire ranging from Bach and the Baroque to twentieth century composers, such as Berio, Boulez, Cage, Henze, Ligeti, Copland and Ives, and is now commissioning new works from exciting, young, twentyfirst century composers.

Since her debut at Glyndebourne - as Diana/Giove in Cavalli's La Calisto, she has sung in opera houses all over the world including The Royal Opera House Covent Garden - where she made her debut as Charlotte in Massenet's Werther opposite Alfredo Kraus; The Metropolitan Opera New York - where she debuted as Micah in Handel's Samson with Jon Vickers in the title role; La Scala - in Britten's Peter Grimes with Philip Langridge in the title role; the Vienna Staatsoper, Le Ch‰Û_ÌÊÌ_åÂå¢telet in Paris, Geneva, Brussels, Hamburg, Munich, Chicago, San Francisco, Lisbon, Madrid and many others. Among more than seventy roles in her repertoire are Didon, Maria Stuarda, Fricka, Klyt‰Û_ÌÊÌ_åÂÌÙmnestra, Dorabella, Donna Elvira, Katisha, Mistress Quickly, numerous Handel and Monteverdi heroines and the title role in Britten's Gloriana, now available on DVD. She took the role of the Marquise de Berkenfeld in Pavarotti's 60th birthday performances of Donizetti's La Fille du Regiment at the Met and recently added four new roles: Mme de Croissy in Dialogues des Carm‰Û_ÌÊÌ_åÂå©lites; the Fortune Teller in Arabella and The Witch in H‰Û_ÌÊÌ_åÂÌÙnsel und Gretel.

On the concert platform Miss Walker has worked with conductors such as Solti, Kleiber, Norrington, Masur, Rattle, Eliot Gardiner, Muti, Harnoncourt, Mackerras, Rozdestvensky and Haitink. She was a memorable Britannia at the Last Night of the Proms in the Royal Albert Hall, London, and took part in the performance of Beethoven's 9th, conducted by the late Leonard Bernstein in Berlin, given to celebrate the opening of the Berlin Wall at Christmas in 1989.

Sarah Walker, however, has perhaps achieved her greatest critical acclaim on the recital platform where she has formed close partnerships with Graham Johnson, Roger Vignoles and Malcolm Martineau. Since the overwhelming success of her Wigmore Hall debut, she has given numerous concerts all over the world and has made over fifty recordings, reflecting her enermous repertoire and her artistry. She was one of the first artists to build a website at <a href=""http://www.sarahwalker.com"">www.sarahwalker.com</a> and she can now also be heard at <a href=""http://www.soundcloud.com"">www.soundcloud.com</a> on a computer near you.",Sarah,Walker,publish,sarah-walker,page
4449,13-12-21,17:45:28,"Pam trained as an Actor Musician at Rose Bruford College, graduating in 2003. Theatre credits include: Jane Eyre (Oddsocks),Emily‰Û_ÌãÌ_‰ö_ÌÔ‰ö_å´s Wish, On the Home Front, Sticks and Stones and Am I Not a Man and a Brother (Reveal Theatre Company), The Lost Warrior(Duke‰Û_ÌãÌ_‰ö_ÌÔ‰ö_å´s Theatre, Lancaster), Blonde Bombshells of 1943 (No. 1 UK tour), A Christmas Carol (Bolton Octagon), Micky Salberg‰Û_ÌãÌ_‰ö_ÌÔ‰ö_å´s Crystal Ballroom Danceband (Watermill Theatre, Newbury), The Merchant of Venice (Changeling Theatre Company), Lucy in The Lion, The Witch and The Wardrobe (New Vic Theatre, Newcastle under Lyme), Marianne inSense and Sensibility and Leanne in the award winning Camp Horror(Queen‰Û_ÌãÌ_‰ö_ÌÔ‰ö_å´s Theatre, Hornchurch). She has also toured Europe, Mexico & the USA as the lead singer in Riverdance.

Over the past eight years, Pam has taught and directed acting, singing and actor-musicianship in colleges, theatres, schools and theatre schools all over the country, including Shakespeare‰Û_ÌãÌ_‰ö_ÌÔ‰ö_å´s Globe Theatre and AIMS.",Pamela,Jolley,publish,pamela-jolley,page
