id,date,time,content,first_name,last_name,status,slug,type
4335,13-12-18,21:40:25,"Steven Rickards has received international acclaim as one of America‰Û_ÌãÌ_‰ö_ÌÔ‰ö_å´s finest countertenors. He recently took part in the premiere of John Adams's oratorio El Ni‰Û_ÌÊÌ_åÂå±o at the Ch‰Û_ÌÊÌ_åÂå¢telet opera in Paris. There have been subsequent performances of the work with the Adelaide Symphony, the BBC Philharmonic, the Deutsches Symphonie Orchester, the Los Angeles Philharmonic, San Francisco Symphony, the Tokyo Symphony, and the Malm‰Û_ÌÊÌ_‰Û_ÌÊÌà Opera (Sweden). His schedule of performances has included frequent appearances Joshua Rifkin and the Bach Ensemble with performances throughout the United States, Europe, and Australia. He has also performed with The American Bach Soloists, Chanticleer, Ensemble Voltaire, the Gabrieli Consort, Chicago ‰Û_ÌãÌ_‰ö_ÌÔ‰ö_å´s Music of the Baroque, the New London Consort, The St. Paul Chamber Orchestra, the Seattle Baroque Orchestra, the Opera Company of Philadelphia, The Santa Fe Opera, and the symphony orchestras of Indianapolis, Pittsburgh, San Francisco, and St. Louis and Tokyo. He has sung at Carnegie Hall with the Oratorio Society of New York, and in France as a soloist with The Festival Singers under the direction of Robert Shaw and with Paul Hillier and the Theatre of Voices. Rickards was the was the soloist in the American premiere performance of Michael Nyman's Self-Laudatory Hymn of Inanna and Her Omnipotence with the Netherlands Wind Ensemble at Lincoln Center's Alice Tully Hall. He has recorded for Chanticleer, Decca, Dorian, Four Winds, Gothic, Harmonia Mundi, Koch, Newport Classics, Smithsonian, and Teldec the labels. Rickards can also be heard on the Naxos label where he has recorded two solo albums with lutenist Dorothy Linell of the songs of John Dowland and Thomas Campion.

Steven currently lives in Indianapolis where he teaches singing at Butler University and the University of Indianapolis, where he is director of the Vocal Arts Institute. He sings regularly with The Choir of Men and Boys at Christ Church Cathedral. He received is doctorate from Florida State University.",Steven,Rickards,publish,steven-rickards,page
4337,13-12-18,21:32:56,"Gregory Rose conducts orchestras, ensembles and choirs throughout Eastern and Western Europe &amp; the Far East, including the Nederland Kamerkoor and the Estonian Philharmonic Chamber Choir. In the UK he has conducted Reading Festival Chorus and London Concert Choir and he is Music Director of Jupiter Orchestra and Singers, the amplified vocal ensemble Singcircle, and CoMA London Ensemble.

He specialises in the Romantic and contemporary repertoires and his compositions include Missa Sancta Pauli Apostoli, winner at the 2006 British Composer Awards. Recent premieres include Missa Sancti Dunstani and Blonde Aphrodite rose up quite naked. He has made many CDs &amp; has arranged &amp; conducted for Linda Ronstadt, Madness and Diana Ross. He is a professor of conducting at Trinity Laban.",Gregory,Rose,publish,gregory-rose,page
4339,13-12-18,21:40:14,"Stephen Varcoe is one of Britain‰Û_ÌãÌ_‰ö_ÌÔ‰ö_å´s most distinguished baritones, especially acclaimed in the field of Baroque music and in the song repertoire. He has made about 150 recordings, collaborating with John Eliot Gardiner for Philips, Erato and DG Archiv on discs of Purcell, Handel and Bach, and has joined Richard Hickox for numerous releases of Haydn, Beethoven, Vaughan Williams, Grainger and Britten on Chandos. His musically fruitful relationship with Hyperion Records has produced many fine recital discs, from the romantic and sensuous French songs of Hahn, Chabrier and Faur‰Û_ÌÊÌ_åÂå© with Graham Johnson to the quintessentially English Finzi, Gurney, Parry, Stanford and Armstrong Gibbs with Clifford Benson and Roger Vignoles. With Graham Johnson, Stephen was the second artist after Dame Janet Baker to be invited to interpret Schubert for the celebrated complete Hyperion series. His versatility also encompasses recordings of twentieth century works by Stravinsky, Schoenberg, Nigel Osborne, Thea Musgrave and John Tavener.

On the concert platform, in a career spanning more than three decades, Stephen has appeared with orchestras all over the world. Highlights include Stravinsky‰Û_ÌãÌ_‰ö_ÌÔ‰ö_å´s Abraham and Isaac in New York with Robert Craft, Stravinsky‰Û_ÌãÌ_‰ö_ÌÔ‰ö_å´s Threni in London with Rozhdestvensky, Holst‰Û_ÌãÌ_‰ö_ÌÔ‰ö_å´s Savitri in Amsterdam with Hickox, C P E Bach‰Û_ÌãÌ_‰ö_ÌÔ‰ö_å´s Die Israeliten in der W‰Û_ÌÊÌ_åÂ‰öÇste in Cologne with Christie, Bach‰Û_ÌãÌ_‰ö_ÌÔ‰ö_å´s Mass in B Minor in Italy with Rifkin, Haydn‰Û_ÌãÌ_‰ö_ÌÔ‰ö_å´s Creation in Lisbon with Br‰Û_ÌÊÌ_åÂ‰öÇggen, Handel‰Û_ÌãÌ_‰ö_ÌÔ‰ö_å´s Apollo and Daphne in Versailles with Minkowski, the centenary performance of Faur‰Û_ÌÊÌ_åÂå©‰Û_ÌãÌ_‰ö_ÌÔ‰ö_å´s Requiem in Paris with Tortelier, and the fortieth anniversary performance of Britten‰Û_ÌãÌ_‰ö_ÌÔ‰ö_å´s War Requiem in Coventry with Cleobury. He has regularly taken part in the BBC Proms and international festivals, and appeared in recital with some of our finest accompanists, particularly Graham Johnson, Iain Burnside, Julius Drake and Roger Vignoles.

His operatic appearances include Haydn‰Û_ÌãÌ_‰ö_ÌÔ‰ö_å´s L‰Û_ÌãÌ_‰ö_ÌÔ‰ö_å´Infedelta Delusa in Antwerp with Kuijken, Debussy‰Û_ÌãÌ_‰ö_ÌÔ‰ö_å´s Fall Of The House Of Usher in Lisbon and London, Tavener‰Û_ÌãÌ_‰ö_ÌÔ‰ö_å´s Mary Of Egypt in Snape, Rameau‰Û_ÌãÌ_‰ö_ÌÔ‰ö_å´s Les Bor‰Û_ÌÊÌ_åÂå©ades in Aix and Lyon with John Eliot Gardiner, Peri‰Û_ÌãÌ_‰ö_ÌÔ‰ö_å´s Euridice for Drottningholm, and Monteverdi‰Û_ÌãÌ_‰ö_ÌÔ‰ö_å´s Orfeo in Japan. His repertoire also includes Death in Holst‰Û_ÌãÌ_‰ö_ÌÔ‰ö_å´s Savitri, Demetrius in Britten‰Û_ÌãÌ_‰ö_ÌÔ‰ö_å´s A Midsummer Night‰Û_ÌãÌ_‰ö_ÌÔ‰ö_å´s Dream and Salieri in Rimsky Korsakov‰Û_ÌãÌ_‰ö_ÌÔ‰ö_å´s Mozart &amp; Salieri. In 2006 he was heard in a BBC broadcast of Malcolm Arnold‰Û_ÌãÌ_‰ö_ÌÔ‰ö_å´s hitherto unperformed opera The Dancing Master. Stephen was in the original cast for Jonathan Miller‰Û_ÌãÌ_‰ö_ÌÔ‰ö_å´s ground-breaking staging of Bach‰Û_ÌãÌ_‰ö_ÌÔ‰ö_å´s St Matthew Passion and its subsequent television production, and revivals in the USA.",Stephen,Varcoe,publish,stephen-varcoe,page
4341,13-12-18,21:25:21,"Alison Wells was born in Yorkshire and originally trained as a pianist. She read Mathematics and Music at London University and then spent a year at the Royal Academy of Music, after which she began her vocal studies. She made her South Bank debut in the Park Lane Group's January Series, and in the same year sang the Governess in the Turn of the Screw and took part in Elisabeth Schwarzkopf's Masterclasses at the Wigmore Hall. Since then she has appeared in all the major London concert halls and in many festivals both at home and abroad.

A large part of Alison Wells' work is in the field of contemporary music, and she has sung with London Sinfonietta, Matrix, Lontano, Music Projects/London, Composers' Ensemble, Kokoro, Psappha, Gemini, Ensemble Corrente, Apartment House, the french ensemble 2e2m, the Schoenberg Ensemble and ASKO in Amsterdam, and Champ d'Action in Antwerp. She broadcasts regularly for Radio 3.

Recent projects have been the premi‰Û_ÌÊÌ_åÂÌ res of Deirdre Gribbin‰Û_ÌãÌ_‰ö_ÌÔ‰ö_å´s ‰Û_ÌãÌ_‰ö_ÌÔ‰ö_‰öÇMare Tran‰Û_ÌãÌ_‰ö_ÌÔ‰ö_ìÛ with the Irish Chamber Orchestra, and the staged version ‰Û_ÌãÌ_‰ö_ÌÔ‰ö_‰öÇCrossing the Sea‰Û_ÌãÌ_‰ö_ÌÔ‰ö_ìÛ at Wilton‰Û_ÌãÌ_‰ö_ÌÔ‰ö_å´s Music Hall and of Colin Riley‰Û_ÌãÌ_‰ö_ÌÔ‰ö_å´s Passing Places for voice, clarinet and electronics, She has recently given performances of Sir Peter Maxwell Davies‰Û_ÌãÌ_‰ö_ÌÔ‰ö_å´s Miss Donnithorne‰Û_ÌãÌ_‰ö_ÌÔ‰ö_å´s Maggot at King‰Û_ÌãÌ_‰ö_ÌÔ‰ö_å´s Place and in Oxford to great acclaim; Le marteau sans maitre with the Warehouse Ensemble in the recent Boulez in Birmingham day; the premiere of ‰Û_ÌãÌ_‰ö_ÌÔ‰ö_‰öÇKrazy Kat‰Û_ÌãÌ_‰ö_ÌÔ‰ö_ìÛ by Joanna Lee in which she plays Offissa Bull-Pup; and a recital for voice and clarinet in Manchester. Her many recordings include a well-received disc of music by Philip Grange, Kaija Saariaho's Grammaire des R‰Û_ÌÊÌ_åÂÌ ves with Champ d‰Û_ÌãÌ_‰ö_ÌÔ‰ö_å´Action, songs by George Nicholson, Nicholas Marshall, Kenneth Leighton, Gerard Schurmann and Alan Rawsthorne, Stravinsky's Les Noces with Robert Craft ‰Û_ÌãÌ_‰ö_ÌÔ‰ö_‰öÇA Stranger Called this Morning‰Û_ÌãÌ_‰ö_ÌÔ‰ö_ìÛ with Kokoro, Pierrot Lunaire with Firebird Ensemble and Silvina Milstein‰Û_ÌãÌ_‰ö_ÌÔ‰ö_å´s Fire Dressed in Black with Lontano, and a disc of voice and clarinet music with Ian Mitchell.

Forthcoming engagements include two performances of Miss Donnithorne‰Û_ÌãÌ_‰ö_ÌÔ‰ö_å´s Maggot in Orkney, as well as composer workshops there; the premiere of ‰Û_ÌãÌ_‰ö_ÌÔ‰ö_‰öÇMary Anning‰Û_ÌãÌ_‰ö_ÌÔ‰ö_ìÛ written for her by Judith Bingham, and Colin Riley‰Û_ÌãÌ_‰ö_ÌÔ‰ö_å´s Science Fictions. A dvd of these pieces will be released later this year.

Alison Wells is in great demand as a teacher of singing and is a member of the vocal department at Trinity Laban Conservatoire of Music and Dance.",Alison,Wells,publish,alison-wells,page
4343,13-12-18,21:38:08,"Richard has been a regular member of the Summer Music team for more than 30 years. He is a teacher of great experience having spent many years teaching juniors at the Hall Junior School in London. He also accompanied in Dublin for the IVM singers course, and has worked on many courses for Jackdaws in the past. He has also been part of the Summer School team of the New London Childrens' Choir for many years. His home is on the Isle of Wight where he accompanies and composes. Here he directs the 'Tritone Singers' who were recently described as 'The Best Choir on the Island'!",Richard,Wilkins,publish,richard-wilkins,page
4345,13-12-18,21:29:02,"For over forty years David has enjoyed a diverse musical career as pianist-partner to some of the finest soloists. He has given concerts and broadcasts with now legendary musicians, including Sir James Galway, Dame Felicity Lott, Anthony Rolfe Johnson, Robert Tear, Christopher Maltman and Dame Elizabeth Schwarzkopf. David partnered the entire recital, recording and broadcasting career of the much-loved Cornish baritone Benjamin Luxon CBE. Together they gave more than 700 concerts throughout Europe, the UK, USA and the Far East. For many years he was a professor of chamber music and accompaniment at the Royal Academy of Music and a director of a London music publishing business. He was the artistic director of the Rye Festival from 1991 to 2004.",David,Willison,publish,david-willison,page
4347,13-12-18,21:39:47,"Stephen Cleobury has for over quarter of a century been associated with one of the world‰Û_ÌãÌ_‰ö_ÌÔ‰ö_å´s most famous choirs, that of King‰Û_ÌãÌ_‰ö_ÌÔ‰ö_å´s College, Cambridge. His work at King‰Û_ÌãÌ_‰ö_ÌÔ‰ö_å´s has brought him into fruitful relationships with many leading orchestras and soloists, among them the Academy of Ancient Music and the Philharmonia. He complements and refreshes his work in Cambridge through the many other musical activities in which he engages.

At King‰Û_ÌãÌ_‰ö_ÌÔ‰ö_å´s, he has sought to maintain and enhance the reputation of the world-famous Choir, considerably broadening the daily service repertoire, commissioning new music from leading composers, principally for A Festival of Nine Lessons and Carols, and developing its activities in broadcasting, recording and touring. He has conceived and introduced the highly successful annual festival, Easter at King‰Û_ÌãÌ_‰ö_ÌÔ‰ö_å´s, from which the BBC regularly broadcasts, and, in its wake, a series of high-profile performances throughout the year, Concerts at King‰Û_ÌãÌ_‰ö_ÌÔ‰ö_å´s. One of the most exciting innovations in this context was the first ever live simultaneous transmission of a concert (Handel Messiah) direct to cinemas across Europe and North America.

Between 1995 and 2007 he was Chief Conductor of the BBC Singers and since then has been Conductor Laureate. During his time with the Singers, he was much praised for creating an integrated choral sound from this group of first-class singers, all of whom are professional soloists in their own right. With the Singers he relished the opportunity to showcase challenging contemporary music and gave a number of important premieres, including Giles Swayne Havoc, Ed Cowie Gaia, and Francis Grier Passion, all these with the distinguished ensemble, Endymion. His many recordings with the BBC Singers include albums of Tippett, Richard Strauss and Bach.

From 1983 to 2009 he was Conductor of the Cambridge University Musical Society, one of the UK‰Û_ÌãÌ_‰ö_ÌÔ‰ö_å´s oldest music societies, a role in which he has not only conducted many orchestral works, but most of the major works for chorus and orchestra. Highlights have included Mahler Symphony No. 8 in the Royal Albert Hall and Britten War Requiem in Coventry Cathedral on the 50th anniversary of its bombing. His recordings with CUMS include Verdi Quattro Pezzi Sacri and Goehr The Death of Moses. As part of the 800th anniversary celebrations of Cambridge University he gave the premi‰Û_ÌÊÌ_åÂÌ re of The Sorcerer‰Û_ÌãÌ_‰ö_ÌÔ‰ö_å´s Mirror by Peter Maxwell Davies.

Performances as an organ recitalist also find him travelling the world. He has played in locations as diverse as Houston and Dallas, Leeds and Birmingham Town Halls, Westminster, Lincoln and St David‰Û_ÌãÌ_‰ö_ÌÔ‰ö_å´s Cathedrals, the Performing Arts Centre in Hong Kong, Haderslev Cathedral in Denmark, and Salt Lake‰Û_ÌãÌ_‰ö_ÌÔ‰ö_å´s huge LDS Conference Center, where he played to an audience of several thousand people. At the American Guild of Organists‰Û_ÌãÌ_‰ö_ÌÔ‰ö_å´ Convention in Minneapolis-St Paul in 2008, he gave the premi‰Û_ÌÊÌ_åÂÌ re of Judith Bingham‰Û_ÌãÌ_‰ö_ÌÔ‰ö_å´s organ concerto, Jacob‰Û_ÌãÌ_‰ö_ÌÔ‰ö_å´s Ladder; in the Messiaen centenary year he performed La Nativit‰Û_ÌÊÌ_åÂå© du Seigneur in King‰Û_ÌãÌ_‰ö_ÌÔ‰ö_å´s Chapel. He has recorded Bach Clavier‰Û_ÌÊÌ_åÂ‰öÇbung Pt.3 and the Leipzig Chorale Preludes for BBC Radio 3; discs of on the organ of King‰Û_ÌãÌ_‰ö_ÌÔ‰ö_å´s include albums of music by Howells and Elgar and Priory Records have released a DVD of popular repertoire.

Stephen has played his part in serving a number of organisations in his field. From his teenage years until 2008 he was a member of the Royal College of Organists, serving this organisation as a Council member, Honorary Secretary, President and Vice-President. He has been Warden of the Solo Performers‰Û_ÌãÌ_‰ö_ÌÔ‰ö_å´ section of the Incorporated Society of Musicians and President of the Incorporated Association of Organists; he is currently Chairman of the IAO Benevolent Fund, which seeks to support organists and church musicians in need. He was appointed CBE in the 2009 Queen‰Û_ÌãÌ_‰ö_ÌÔ‰ö_å´s Birthday Honours.",Stephen,Cleobury,publish,stephen-cleobury,page
4349,13-12-18,21:38:41,"Recent freelance professional work (2008-2013) includes Journey to the East (Cyprus);Voices of Arran (Scotland); They Called It Passchendaele (Belgium); King Macbeth (National Tour); The Savonarola Debate (Florence, Italy); Jack and the Beanstalk starring Lynne McGranger (Home and Away) and Frazer Hines; Silent Anger (Tour as Producer);Dave Simpson‰Û_ÌãÌ_‰ö_ÌÔ‰ö_å´s new play Cock Tales and Cry Havoc! (Manchester); Journey to the East (Buffavento Castle, Cyprus); Aladdin and Sleeping Beauty (Halifax and Reading) with Cbeebies‰Û_ÌãÌ_‰ö_ÌÔ‰ö_å´ Justin Fletcher and Emmerdale‰Û_ÌãÌ_‰ö_ÌÔ‰ö_å´s Leah Bracknell. He is currently working on developing projects for the Victoria Theatre, Halifax.

In repertory, he has worked at the Yvonne Arnaud Guildford, Stephen Joseh Scarborough, Bolton Octagon, Southwark Playhouse, Oxford Playhouse and Aberystwyth Arts Centre.

Robert also spent 5 years at the New Vic Theatre, Newcastle under Lyme as an assistant then associate working on over 25 productions for all departments including mainstage, studio, education and Borderlines outreach. Productions in rep ranged from working with Sir Alan Ayckbourn on his play Sugar Daddies (National No 1 Tour) and productions such as Harvest (devised), Some Enchanted Evening, A Broadway Songbook, Carmen, Cabaret, Outside Edge, Sweeney Todd and Romeo and Juliet.

Commercially, he has been Staff and Associate Director on The Extra Factor with Kevin Kennedy and Antony Costa (Blue); The Naked Truth with Lisa Riley and Julie Buckfield and Over the Rainbow (all National Touring) as well as summer season productions for Blackpool Pleasure Beach.

Since 1999, Robert has been heavily involved in pantomime, and has written and directed several productions in Stoke on Trent, Rugeley Rose Theatre, Ammanford Miner‰Û_ÌãÌ_‰ö_ÌÔ‰ö_å´s Theatre, South Wales, Wrexham, Ickenham (London) and Belfast. Since 2007, Robert has worked for producer Stephen Boden at WISH Theatre and then Imagine Theatre Ltd. Pantomimes for Imagine have been at Halifax (4 years) Crewe (2 years), Porthcawl, Halifax as well as Loughborough and Reading.

Robert combines his professional directing work with lecturing and guest directing at Universities and Drama Schools. As well as Staffordshire, he has worked at The Arden School of Theatre, Expressions Academy, Manchester Metropolitan, Keele University and Aberystwyth University.

Writing has included A Sense of (re)Direction and The Story of Mrs M (New Vic) as well as numerous pantomimes. He is a member of the Equity and the DGGB and has worked for BBC Radio 4 Drama and Television.",Robert,Marsden,publish,robert-marsden,page
4351,13-12-18,21:34:14,"John is an opera producer and writer, his performed and published work stretching from opera to novels to television. A native of East Anglia, he was educated at Fitzwilliam College, Cambridge where he read History.

John‰Û_ÌãÌ_‰ö_ÌÔ‰ö_å´s operatic work as a director includes La finta giardiniera, School For Fathers, The Choice of Hercules (Royal Academy of Music), The Marriage of Figaro for Mid-Wales Opera (nominated for a Prudential award), L‰Û_ÌãÌ_‰ö_ÌÔ‰ö_å´elisir d‰Û_ÌãÌ_‰ö_ÌÔ‰ö_å´amore (also Mid-Wales), Rigoletto (Pimlico Opera), The Magic Flute (Garden Opera), Cos‰Û_ÌÊÌ_åÂå¨ fan tutte and Falstaff for London Opera Players, L‰Û_ÌãÌ_‰ö_ÌÔ‰ö_å´enfant et les sortil‰Û_ÌÊÌ_åÂå©ges, Doctor Miracle, Semele and Eugene Onegin (Birmingham Conservatoire). Most recently he has directed Hansel and Gretel for Opera Theatre Company on a national tour of Ireland, Rinaldo for the Royal Academy of Music and L‰Û_ÌãÌ_‰ö_ÌÔ‰ö_å´elisir d‰Û_ÌãÌ_‰ö_ÌÔ‰ö_å´amore and Don Giovanni for Opera Faber in Portugal.

His assistant directing work ranges from London‰Û_ÌãÌ_‰ö_ÌÔ‰ö_å´s West End with Lloyd-Webber‰Û_ÌãÌ_‰ö_ÌÔ‰ö_å´s Joseph at the London Palladium and Rattigan‰Û_ÌãÌ_‰ö_ÌÔ‰ö_å´s Separate Tables directed by Sir Peter Hall at the Albery to Handel‰Û_ÌãÌ_‰ö_ÌÔ‰ö_å´s Giulio Cesare for the Royal Opera, Covent Garden by way of over 20 productions with the Glyndebourne Festival and Tour where John worked with directors such as Peter Sellars, Deborah Warner, Graham Vick and Trevor Nunn, reviving the noted productions of Theodora, Don Giovanni and Cos‰Û_ÌÊÌ_åÂå¨. Other revivals include the late Clare Venables‰Û_ÌãÌ_‰ö_ÌÔ‰ö_å´ productions of The Magic Flute (Opera Northern Ireland and Dublin Grand Opera Society), Albert Herring (Opera 80) and Turnage‰Û_ÌãÌ_‰ö_ÌÔ‰ö_å´s Greek (London Sinfonietta.)

He has been Drama Lecturer for Royal Academy Opera for the last four years and is an elected Honorary Associate of the Academy where he regularly directs scenes with the Vocal and Opera departments . He has also taught and directed at the Casa da Musica Studio in Porto, the Guildhall School of Music &amp; Drama, the Royal College of Music, the Royal Scottish Academy of Music &amp; Drama, Morley College, London City Opera, Abbey Opera at Birkbeck College, as well as lecturing on stagecraft and opera at the universities of Plymouth, Exeter, Toronto and Oxford. He is a visiting tutor for the Bristol Old Vic Theatre School Design Course and a recipient of the Glyndebourne Festival/Keith Showering Memorial Award as well as a Churchill Fellowship in Opera Production and Design. John‰Û_ÌãÌ_‰ö_ÌÔ‰ö_å´s writing career began in 1999 with the publication of a novel, Ladies‰Û_ÌãÌ_‰ö_ÌÔ‰ö_å´ Man, translated into seven languages. His television work includes several episodes of the Sky comedy drama Mile High.",John,Ramster,publish,john-ramster,page
4353,13-12-18,21:25:55,"Ameral Gunson studied singing with Walther Gruner at the Guildhall School of Music and Drama. She joined the BBC Singers for four years, during which time she continued her studies with the charismatic teacher Otakar Kraus. After leaving the Singers she quickly established a highly successful solo career in England and in the opera houses and concert halls of Europe.

She worked regularly with all the top British and European orchestras under Matthias Bamert, Pierre Boulez, Andrew Davis, Edward Downes, Richard Hickox, Charles Mackerras, Kurt Masur, Libor Pesek, Simon Rattle, Gennadi Rozhdestvensky and many others.

Having sung for over 30 years Ameral has retired to concentrate on teaching and is now on the staff of Trinity Laban.",Ameral,Gunson,publish,ameral-gunson,page
